{
  "$schema": "./engineering-rule-pack.schema.json",
  "schema_version": "semantic-guard-vnext-engineering-rule-pack/v0",
  "pack_id": "engineering-rule-pack.functional-requirement-record",
  "version": "candidate-2026-07-16",
  "title": "Functional requirement relation engineering-basis candidate register",
  "purpose": "Expose the proposed engineering basis, local implementation mapping, non-applicability conditions, evidence needs, and adoption boundary for every functional-requirement relation obligation.",
  "scope": "The eleven obligations in functional-requirement-record/v1 and the eleven direct-rule identifiers currently used to assess them.",
  "created_at": "2026-07-16T13:47:09+09:00",
  "profile": {
    "profile_id": "functional-requirement-record",
    "version": "v1",
    "local_locator": "vnext/src/semantic_guard_vnext/profiles.py"
  },
  "status": "candidate_pending_human_adoption",
  "runtime_authority": "none",
  "standards_conformance_claimed": false,
  "sources": [
    {
      "source_id": "source.iso-iec-ieee-29148.2018",
      "title": "ISO/IEC/IEEE 29148:2018 Systems and software engineering — Life cycle processes — Requirements engineering",
      "version": "Edition 2, 2018-11; confirmed 2024; revision stage 90.92 dated 2026-02-16",
      "status": "published_current_to_be_revised",
      "official_locator": "https://www.iso.org/standard/72089.html",
      "section_locators": [
        "Public abstract (processes, information items, and formats); licensed clause text not acquired",
        "Lifecycle status 90.92 and replacement link"
      ],
      "acquisition": {
        "state": "official_locator_metadata_only",
        "exact_source_text_acquired": false,
        "observed_at": "2026-07-16T13:47:09+09:00",
        "content_digest": {"state": "not_computed", "algorithm": "sha256"},
        "notes": [
          "Only the official product-page metadata and public abstract were inspected.",
          "No licensed clause text was copied into this repository or digested."
        ]
      },
      "copyright_limit": "ISO material is copyright protected; this register keeps only a short locator and an original paraphrase, and does not reproduce clauses.",
      "review_triggers": [
        "Publication of ISO/IEC/IEEE DIS 29148 or another replacement requires source replacement and fresh human review.",
        "A change to stage 90.92, edition, confirmation status, or official locator requires metadata re-verification.",
        "Licensed clause-text acquisition requires a new content digest and clause-level mapping review."
      ]
    },
    {
      "source_id": "source.nasa-se-handbook.technical-requirements-definition",
      "title": "NASA Systems Engineering Handbook web reference: 4.2 Technical Requirements Definition",
      "version": "Official NASA web rendition observed 2026-07-16; handbook edition not asserted by the page",
      "status": "official_guidance_web_currentness_unasserted",
      "official_locator": "https://www.nasa.gov/reference/4-2-technical-requirements-definition/",
      "section_locators": [
        "4.2 overview",
        "4.2.1.2.1 Define Constraints, Functional and Behavioral Expectations",
        "4.2.1.2.2 Define Requirements"
      ],
      "acquisition": {
        "state": "official_web_page_observed_not_archived",
        "exact_source_text_acquired": false,
        "observed_at": "2026-07-16T13:47:09+09:00",
        "content_digest": {"state": "not_computed", "algorithm": "sha256"},
        "notes": [
          "The official page and named headings were inspected but no immutable source snapshot was archived.",
          "The page alone does not establish a stable handbook edition identifier."
        ]
      },
      "copyright_limit": "No page text is reproduced; mappings are original paraphrases tied to heading locators.",
      "review_triggers": [
        "NASA changes the official page, heading structure, or underlying handbook edition.",
        "A stable, dated handbook edition is acquired and digested.",
        "A mapping is promoted beyond candidate status."
      ]
    },
    {
      "source_id": "source.nasa-se-handbook.good-requirement-checklist",
      "title": "NASA Systems Engineering Handbook web reference: Appendix C How to Write a Good Requirement",
      "version": "Official NASA web rendition observed 2026-07-16; handbook edition not asserted by the page",
      "status": "official_guidance_web_currentness_unasserted",
      "official_locator": "https://www.nasa.gov/reference/appendix-c-how-to-write-a-good-requirement/",
      "section_locators": [
        "C.2 Editorial Checklist",
        "C.4 Requirements Validation Checklist — Clarity",
        "C.4 Requirements Validation Checklist — Completeness",
        "C.4 Requirements Validation Checklist — Performance",
        "C.4 Requirements Validation Checklist — Verifiability/Testability"
      ],
      "acquisition": {
        "state": "official_web_page_observed_not_archived",
        "exact_source_text_acquired": false,
        "observed_at": "2026-07-16T13:47:09+09:00",
        "content_digest": {"state": "not_computed", "algorithm": "sha256"},
        "notes": [
          "The official page and named checklist headings were inspected but no immutable source snapshot was archived.",
          "Checklist interpretation remains distinct from the local eleven-relation profile."
        ]
      },
      "copyright_limit": "No checklist wording is reproduced; mappings use original paraphrases and heading locators only.",
      "review_triggers": [
        "NASA changes the official checklist, heading structure, or underlying handbook edition.",
        "A stable, dated handbook edition is acquired and digested.",
        "An organizational tailoring decision accepts, rejects, or alters a checklist interpretation."
      ]
    },
    {
      "source_id": "source.nasa-se-handbook.requirements-verification-matrix",
      "title": "NASA Systems Engineering Handbook web reference: Appendix D Requirements Verification Matrix",
      "version": "Official NASA web rendition observed 2026-07-16; handbook edition not asserted by the page",
      "status": "official_guidance_web_currentness_unasserted",
      "official_locator": "https://www.nasa.gov/reference/appendix-d-requirements-verification-matrix/",
      "section_locators": [
        "Appendix D introductory guidance and Table D-1 locator"
      ],
      "acquisition": {
        "state": "official_web_page_observed_not_archived",
        "exact_source_text_acquired": false,
        "observed_at": "2026-07-16T13:47:09+09:00",
        "content_digest": {"state": "not_computed", "algorithm": "sha256"},
        "notes": [
          "The official introductory guidance and table locator were inspected but the matrix image was not transcribed or archived.",
          "The page supports planning traceability, not proof that a particular verification was executed."
        ]
      },
      "copyright_limit": "No matrix or page text is reproduced; the register retains only the heading locator and original paraphrases.",
      "review_triggers": [
        "NASA changes the matrix guidance, table structure, or underlying handbook edition.",
        "The matrix fields are mapped at clause or column level from an acquired, digested edition.",
        "A local verification contract changes."
      ]
    },
    {
      "source_id": "source.ears.re-2009.9",
      "title": "Easy Approach to Requirements Syntax (EARS)",
      "version": "Mavin, Wilkinson, Harwood, and Novak; RE 2009; DOI 10.1109/RE.2009.9",
      "status": "published_research_metadata_verified",
      "official_locator": "https://doi.org/10.1109/RE.2009.9",
      "section_locators": [
        "Public abstract (full paper sections not acquired)",
        "Bibliographic record and DOI 10.1109/RE.2009.9"
      ],
      "acquisition": {
        "state": "official_locator_metadata_only",
        "exact_source_text_acquired": false,
        "observed_at": "2026-07-16T13:47:09+09:00",
        "content_digest": {"state": "not_computed", "algorithm": "sha256"},
        "notes": [
          "The DOI and University of Manchester bibliographic record and abstract were inspected.",
          "The full paper and its exact template definitions were not acquired or digested."
        ]
      },
      "copyright_limit": "No paper text or template is reproduced; this register records bibliographic metadata and an original high-level interpretation only.",
      "review_triggers": [
        "The full paper is lawfully acquired and a section-level digest and mapping become available.",
        "A later authoritative EARS version or erratum is selected.",
        "A local rule claims conformance to an EARS template rather than loose conceptual influence."
      ]
    }
  ],
  "rules": [
    {
      "rule_id": "engineering.functional.applies-to",
      "version": "v0",
      "profile_obligation_refs": ["func.applies_to"],
      "local_implementation_rule_refs": [
        {"rule_id": "direct.dimension.applies-to/v2", "locator": "vnext/src/semantic_guard_vnext/direct_rules.py", "mapping_status": "candidate_semantic_correspondence"}
      ],
      "engineering_proposition": "A functional requirement should identify the system or responsible product context to which the required behavior applies.",
      "interpretation": "The local purpose-to-user relation is a repository-specific proxy for a bounded applicable actor or system context; neither field co-presence nor lexical overlap alone proves applicability.",
      "applicability": ["Structured functional-requirement records that declare both a purpose and a user or system actor."],
      "counterconditions": ["The input contract already provides a separately validated and uniquely identified system-of-interest relation."],